<?xml version="1.0" encoding="UTF-8"?>
<!DOCTYPE stream SYSTEM "streamDocType.dtd">
<stream>
	<name>opinion</name>
	<type>relational</type>
	<attributes>
		<attribute type="enumerate" name="name">
			<value type="option">Josiane</value>
			<value type="option">Monique</value>
			<value type="option">Veronique</value>
			<value type="option">Ghislaine</value>
			<value type="option">Viviane</value>
			<value type="option">Virginie</value>
			<value type="option">Therese</value>
			<value type="option">Marie-Solange</value>
			<value type="option">Nadege</value>
		</attribute>
		<attribute type="integer" name="age">
			<value type="min">16</value>
			<value type="max">76</value>
		</attribute>
		<attribute type="enumerate" name="city">
			<value type="option">NY</value>
			<value type="option">TKY</value>
			<value type="option">PAR</value>
			<value type="option">BER</value>
			<value type="option">MAD</value>
			<value type="option">TAC</value>
			<value type="option">LIS</value>
			<value type="option">ROM</value>
			<value type="option">BRA</value>
			<value type="option">SYD</value>
		</attribute>
		<attribute type="enumerate" name="opinion">
			<value type="option">very negative</value>
			<value type="option">negative</value>
			<value type="option">neutral</value>
			<value type="option">positive</value>
			<value type="option">very positive</value>
		</attribute>
	</attributes>
</stream>