<?xml version="1.0" encoding="UTF-8"?>
<!DOCTYPE stream SYSTEM "streamDocType.dtd">
<stream>
	<name>student</name>
	<type>relational</type>
	<attributes>
		<attribute type="text" name="identifiant">
			<value type="pattern" length="12">[A-9]</value>
		</attribute>
		<attribute type="enumerate" name="prenom">
			<value type="option">Josiane</value>
			<value type="option">Monique</value>
			<value type="option">Veronique</value>
			<value type="option">Ghislaine</value>
			<value type="option">Viviane</value>
			<value type="option">Virginie</value>
			<value type="option">Therese</value>
			<value type="option">Chantal</value>
			<value type="option">Marie-Solange</value>
			<value type="option">Nadege</value>
		</attribute>
		<attribute type="enumerate" name="nom">
			<value type="option">Chambon</value>
			<value type="option">Berenger</value>
			<value type="option">Bernard</value>
			<value type="option">Shapiro</value>
			<value type="option">Pignon</value>
		</attribute>
		<attribute type="integer" name="age">
			<value type="min">18</value>
			<value type="max">25</value>
		</attribute>
		<attribute type="enumerate" name="dept">
			<value type="option">INFO</value>
			<value type="option">MECA</value>
			<value type="option">BIO</value>
		</attribute>
		<attribute type="enumerate" name="promotion">
			<value type="option">L1</value>
			<value type="option">L2</value>
			<value type="option">L3</value>
			<value type="option">M1</value>
			<value type="option">M2</value>
		</attribute>
		<attribute type="enumerate" name="parcours">
			<value type="option">professionel</value>
			<value type="option">recherche</value>
			<value type="option">alternant</value>
		</attribute>
	</attributes>
</stream>